{
  "$schema": "../_schema.json",
  "format": "xlsx",
  "element": "chart-axis",
  "parent": "chart",
  "operations": {
    "add": false,
    "set": true,
    "get": true,
    "remove": false
  },
  "note": "Axes are created/destroyed implicitly by chartType changes, not via Add/Remove on axis directly. Extended charts (funnel/treemap/sunburst/boxWhisker/histogram) reject axis path — use chart-level Set. Add-time configuration: use the chart element's axis* props (axismin, axismax, axistitle, axisfont, ...) when creating the chart; chart-axis covers post-creation Set/Get.",
  "addressing": {
    "key": "role",
    "pathForm": "/SheetName/chart[N]/axis[@role=ROLE]",
    "keyValues": ["category", "value", "value2", "series"]
  },
  "properties": {
    "title":          { "type": "string", "description": "axis title text. Applies to all roles (category, value). Pass 'none' to remove.", "set": true, "get": true, "examples": ["--prop title=\"Revenue\""], "enforcement": "report" },
    "visible":        { "type": "bool",   "description": "show or hide the axis. Applies to all roles.", "set": true, "get": true, "examples": ["--prop visible=false"], "enforcement": "report" },
    "min":            { "type": "number", "description": "minimum scale of the value axis. Only valid for role=value or role=value2; ignored on category axes.", "set": true, "get": true, "appliesWhen": { "role": ["value","value2"] }, "examples": ["--prop min=0"], "enforcement": "report" },
    "max":            { "type": "number", "description": "maximum scale of the value axis. Only valid for role=value or role=value2; ignored on category axes.", "set": true, "get": true, "appliesWhen": { "role": ["value","value2"] }, "examples": ["--prop max=1000"], "enforcement": "report" },
    "logBase":        { "type": "number", "description": "logarithmic base for value axis scale. Only valid for role=value or role=value2; ignored on category axes.", "set": true, "get": true, "appliesWhen": { "role": ["value","value2"] }, "examples": ["--prop logBase=10"], "readback": "number (e.g. 10)", "enforcement": "report" },
    "format":         { "type": "string", "description": "number format string", "set": true, "get": true, "examples": ["--prop format=\"#,##0\""], "enforcement": "report" },
    "labelRotation":  { "type": "number", "description": "tick label rotation in degrees", "set": true, "get": true, "examples": ["--prop labelRotation=-45"], "enforcement": "report" },
    "majorGridlines": { "type": "bool",   "description": "show or hide major gridlines. Applies to all roles.", "set": true, "get": true, "examples": ["--prop majorGridlines=true"], "enforcement": "report" },
    "minorGridlines": { "type": "bool",   "description": "show or hide minor gridlines. Applies to all roles.", "set": true, "get": true, "examples": ["--prop minorGridlines=false"], "enforcement": "report" },
    "majorUnit": { "type":"number", "add":false, "set":true, "get":true, "description":"major tick interval on the value axis. Applies to role=value|value2.", "readback":"numeric interval", "examples":["--prop majorUnit=20"], "enforcement":"report" },
    "minorUnit": { "type":"number", "add":false, "set":true, "get":true, "description":"minor tick interval on the value axis. Applies to role=value|value2.", "readback":"numeric interval", "examples":["--prop minorUnit=5"], "enforcement":"report" },
    "dispUnits": { "type":"enum", "values":["hundreds","thousands","tenThousands","hundredThousands","millions","tenMillions","hundredMillions","billions","trillions"], "add":false, "set":true, "get":true, "description":"display units for value axis labels. Applies to role=value|value2.", "readback":"display unit token", "examples":["--prop dispUnits=thousands"], "enforcement":"report" }
  }
}
