{
  "$schema": "../_schema.json",
  "format": "pptx",
  "element": "animation",
  "parent": ["shape", "chart"],
  "operations": {
    "add": true,
    "set": true,
    "get": true,
    "query": true,
    "remove": true
  },
  "paths": {
    "positional": [
      "/slide[N]/shape[M]/animation[K]",
      "/slide[N]/chart[M]/animation[K]"
    ]
  },
  "note": "Animation attached to a shape or a chart graphicFrame. Effect name drives the timing preset; trigger controls sequencing (onClick / withPrevious / afterPrevious). On Get, returns individual keys: effect (preset name), class (entrance/emphasis/exit), presetId (numeric), trigger (onClick/afterPrevious/withPrevious), duration (ms integer), and (when set) repeat / restart / autoReverse. Chart targets additionally surface chartBuild (asWhole | series | category | seriesEl | categoryEl) to control per-series/category build animation — written into <p:bldGraphic><p:bldSub><a:bldChart bld=.../> alongside the timing tree. No composite 'animation' key is emitted. The `direction` parameter is consumed at Add time and not surfaced on Get.",
  "properties": {
    "effect": {
      "type": "enum",
      "description": "animation preset. spin/grow/bold/wave require class=emphasis; appear/fade/fly/zoom/wipe/bounce/float/swivel/split/wheel/checkerboard/blinds/dissolve/flash/box/circle/diamond/plus/strips/wedge/random work for entrance and exit. (disappear is not supported — use class=exit + appear or fade.)",
      "values": ["appear", "fade", "fly", "zoom", "wipe", "bounce", "float", "swivel", "split", "wheel", "checkerboard", "blinds", "dissolve", "flash", "box", "circle", "diamond", "plus", "strips", "wedge", "random", "spin", "grow", "wave", "bold"],
      "add": true, "set": true, "get": true,
      "examples": ["--prop effect=fade", "--prop effect=spin --prop class=emphasis"],
      "readback": "effect name",
      "enforcement": "report"
    },
    "class": {
      "type": "enum",
      "description": "animation category — entrance, exit, emphasis, or motion. spin/grow/wave only work with emphasis; motion needs path=<preset|custom>.",
      "values": ["entrance", "exit", "emphasis", "motion"],
      "add": true, "set": true, "get": true,
      "examples": ["--prop class=entrance", "--prop class=motion --prop path=line"],
      "readback": "entrance | exit | emphasis | motion",
      "enforcement": "report"
    },
    "path": {
      "type": "enum",
      "description": "Motion-path preset (only valid when class=motion). 'custom' requires d=<SVG-like path data>. Direction-aware presets (line, arc) accept direction= for variants.",
      "values": ["line", "arc", "circle", "diamond", "triangle", "square", "custom"],
      "add": true, "set": true, "get": true,
      "examples": ["--prop class=motion --prop path=line --prop direction=right", "--prop class=motion --prop path=circle"],
      "readback": "preset name (line | arc | circle | diamond | triangle | square | custom)",
      "enforcement": "report"
    },
    "d": {
      "type": "string",
      "description": "Custom motion-path data (SVG-like; only valid when class=motion and path=custom). Coords are relative to slide (0..1). Must end with 'E' (auto-appended if missing).",
      "add": true, "set": true, "get": true,
      "examples": ["--prop class=motion --prop path=custom --prop d='M 0 0 L 0.5 0 E'"],
      "readback": "raw OOXML animMotion path string, only when path=custom",
      "enforcement": "report"
    },
    "trigger": {
      "type": "enum",
      "values": ["onClick", "withPrevious", "afterPrevious"],
      "add": true, "set": true, "get": true,
      "examples": ["--prop trigger=onClick"],
      "readback": "trigger mode",
      "enforcement": "report"
    },
    "duration": {
      "type": "number",
      "description": "Animation duration in milliseconds (integer, e.g. 500 = 0.5s).",
      "aliases": ["dur"],
      "add": true, "set": true, "get": true,
      "examples": ["--prop duration=500", "--prop dur=2000"],
      "readback": "duration in milliseconds",
      "enforcement": "report"
    },
    "delay": {
      "type": "number",
      "description": "Delay before starting in milliseconds (integer, e.g. 500 = 0.5s).",
      "add": true, "set": true, "get": true,
      "examples": ["--prop delay=200"],
      "readback": "delay in milliseconds",
      "enforcement": "report"
    },
    "direction": {
      "type": "string",
      "description": "direction for directional effects (in/out/left/right/up/down).",
      "add": true, "set": true, "get": false,
      "examples": ["--prop direction=in"],
      "readback": "packed into the 'animation' key value as 'effectName-class-direction-duration' (e.g. 'fly-entrance-left-500'); no standalone 'direction' key is emitted on Get",
      "enforcement": "report"
    },
    "repeat": {
      "type": "string",
      "description": "Number of times the animation repeats. Accepts a positive integer (e.g. 3) or the literal 'indefinite' to loop forever. Stored as OOXML @repeatCount (count*1000 or 'indefinite').",
      "add": true, "set": true, "get": true,
      "examples": ["--prop repeat=3", "--prop repeat=indefinite"],
      "readback": "positive integer count, or the literal 'indefinite'",
      "enforcement": "report"
    },
    "restart": {
      "type": "enum",
      "description": "What happens when the trigger fires again after the animation has played. always = restart; whenNotActive = restart only if not currently playing; never = do nothing.",
      "values": ["always", "whenNotActive", "never"],
      "add": true, "set": true, "get": true,
      "examples": ["--prop restart=always", "--prop restart=whenNotActive"],
      "readback": "always | whenNotActive | never",
      "enforcement": "report"
    },
    "autoReverse": {
      "type": "bool",
      "description": "When true, the animation plays forward then in reverse, doubling its visible run. Maps to OOXML cTn @autoRev.",
      "add": true, "set": true, "get": true,
      "examples": ["--prop autoReverse=true"],
      "readback": "true when @autoRev=1 is present, omitted otherwise",
      "enforcement": "report"
    },
    "presetId": {
      "type": "number",
      "add": false, "set": false, "get": true,
      "description": "raw OOXML preset id for the animation effect. Emitted when the effect has a recognized preset.",
      "readback": "integer",
      "enforcement": "report"
    },
    "easein":     { "type":"number", "add":false, "set":false, "get":true, "description":"acceleration percentage (0..100) — fraction of the duration spent ramping up.", "readback":"integer percent", "enforcement":"report" },
    "easeout":    { "type":"number", "add":false, "set":false, "get":true, "description":"deceleration percentage (0..100) — fraction of the duration spent ramping down.", "readback":"integer percent", "enforcement":"report" },
    "motionPath": { "type":"string", "add":false, "set":false, "get":true, "description":"motion-path SVG-like path string (animMotion @path) for path animations.", "readback":"OOXML animMotion path string", "enforcement":"report" },
    "chartBuild": {
      "type": "enum",
      "description": "Chart-internal build animation (only valid when the parent path is /slide[N]/chart[M]). Controls how chart elements appear under the entrance effect: asWhole (default — entire chart as one), series (one series at a time), category (one category at a time), seriesEl (each data point per series), categoryEl (each data point per category). Aliases accepted on input: bySeries, byCategory, bySeriesEl, byCategoryEl. Writes <a:bldChart bld='...'/> inside <p:bldGraphic><p:bldSub>. To change chartBuild after creation, re-Add the animation on the chart — re-Add replaces the BuildGraphics entry. Set on /slide[N]/chart[M]/animation[K] is not yet routed.",
      "values": ["asWhole", "series", "category", "seriesEl", "categoryEl"],
      "aliases": ["bySeries", "byCategory", "bySeriesEl", "byCategoryEl"],
      "add": true, "set": false, "get": true,
      "examples": [
        "--prop \"effect=fade;class=entrance;chartBuild=byCategory\"",
        "--prop \"effect=wipe;chartBuild=series;trigger=afterPrevious;duration=500\""
      ],
      "readback": "asWhole | series | category | seriesEl | categoryEl",
      "enforcement": "report"
    }
  }
}
